### ISSUE TITLE
Is it possible to add support for Hammer miners?

### ISSUE THREAD

**Issue by Combinator78** [UpstreamData/pyasic#231]
miners get_data() does not return any results
http://root:root@[172.16.26.9/cgi-bin/get_system_info.cgi?_=1730918561512](http://root:root@172.16.26.9/cgi-bin/get_system_info.cgi?_=1730918561512)
{
"minertype":"Hammer D10",
"nettype":"DHCP",
"netdevice":"eth0",
"macaddr":"50:33:8B:03:E5:4F",
"hostname":"Hammer",
"ipaddress":"172.16.26.9",
"netmask":"255.255.255.0",
"gateway":"",
"dnsservers":"",
"curtime":"18:46:15",
"uptime":"92",
"loadaverage":"1.06, 1.36, 1.48",
"mem_total":"251180",
"mem_used":"64392",
"mem_free":"186788",
"mem_buffers":"0",
"mem_cached":"0",
"system_mode":"GNU/Linux",
"bb_hwv":"2.0.2.2",
"system_kernel_version":"Linux 3.8.13 #22 SMP Tue Dec 2 15:26:11 CST 2014",
"system_filesystem_version":"2022-11-11 13-46-30 CST",
"cgminer_version":"2.3.3"
}

![hammer4](https://github.com/user-attachments/assets/53974d3f-c64a-43ac-936a-3a8546bb899b)
![hammer](https://github.com/user-attachments/assets/d1ba5ff8-c0cc-4441-8b3c-ea271c14c5d9)
![hammer2](https://github.com/user-attachments/assets/3f6b0ac7-1458-4ac1-a0f0-13a67c09d7d8)
![hammer3](https://github.com/user-attachments/assets/36fd3754-e4de-4aa6-9d17-e4a85655c8a2)

**Comment by b-rowan** [comment]
Those are interesting...

Does `pyasic.get_miner("172.16.26.9")` return an unknown miner or antminer?  Can start testing from there...

**Comment by Combinator78** [comment]
async def get_miners():
    miner_1 = await get_miner("172.16.26.13")
    print(miner_1)
if __name__ == "__main__":
    asyncio.run(get_miners())

returns the answer    
None

**Comment by Combinator78** [comment]
Listening to ports while running the get_miner command returned the result on port 80:

Frame 1057: 655 bytes on wire (5240 bits), 655 bytes captured (5240 bits) on interface \Device\NPF_{44671B79-9029-49A8-9492-11F546793270}, id 0
    Section number: 1
    Interface id: 0 (\Device\NPF_{44671B79-9029-49A8-9492-11F546793270})
        Interface name: \Device\NPF_{44671B79-9029-49A8-9492-11F546793270}
        Interface description: Ethernet
    Encapsulation type: Ethernet (1)
    Arrival Time: Nov 13, 2024 07:13:23.672535000 RTZ 2 (зима)
    [Time shift for this packet: 0.000000000 seconds]
    Epoch Time: 1731471203.672535000 seconds
    [Time delta from previous captured frame: 0.000845000 seconds]
    [Time delta from previous displayed frame: 0.000845000 seconds]
    [Time since reference or first frame: 4.709008000 seconds]
    Frame Number: 1057
    Frame Length: 655 bytes (5240 bits)
    Capture Length: 655 bytes (5240 bits)
    [Frame is marked: False]
    [Frame is ignored: False]
    [Protocols in frame: eth:ethertype:ip:tcp:http:data-text-lines:xml]
    [Coloring Rule Name: HTTP]
    [Coloring Rule String: http || tcp.port == 80 || http2]
Ethernet II, Src: Routerbo_e0:78:75 (64:d1:54:e0:78:75), Dst: Giga-Byt_bb:0a:b8 (18:c0:4d:bb:0a:b8)
    Destination: Giga-Byt_bb:0a:b8 (18:c0:4d:bb:0a:b8)
        Address: Giga-Byt_bb:0a:b8 (18:c0:4d:bb:0a:b8)
        .... ..0. .... .... .... .... = LG bit: Globally unique address (factory default)
        .... ...0 .... .... .... .... = IG bit: Individual address (unicast)
    Source: Routerbo_e0:78:75 (64:d1:54:e0:78:75)
        Address: Routerbo_e0:78:75 (64:d1:54:e0:78:75)
        .... ..0. .... .... .... .... = LG bit: Globally unique address (factory default)
        .... ...0 .... .... .... .... = IG bit: Individual address (unicast)
    Type: IPv4 (0x0800)
Internet Protocol Version 4, Src: 172.16.43.58, Dst: 172.16.0.249
    0100 .... = Version: 4
    .... 0101 = Header Length: 20 bytes (5)
    Differentiated Services Field: 0x00 (DSCP: CS0, ECN: Not-ECT)
        0000 00.. = Differentiated Services Codepoint: Default (0)
        .... ..00 = Explicit Congestion Notification: Not ECN-Capable Transport (0)
    Total Length: 641
    Identification: 0x83a1 (33697)
    010. .... = Flags: 0x2, Don't fragment
        0... .... = Reserved bit: Not set
        .1.. .... = Don't fragment: Set
        ..0. .... = More fragments: Not set
    ...0 0000 0000 0000 = Fragment Offset: 0
    Time to Live: 63
    Protocol: TCP (6)
    Header Checksum: 0x3182 [validation disabled]
    [Header checksum status: Unverified]
    Source Address: 172.16.43.58
    Destination Address: 172.16.0.249
Transmission Control Protocol, Src Port: 80, Dst Port: 26211, Seq: 1, Ack: 141, Len: 601
    Source Port: 80
    Destination Port: 26211
    [Stream index: 52]
    [Conversation completeness: Complete, WITH_DATA (31)]
    [TCP Segment Len: 601]
    Sequence Number: 1    (relative sequence number)
    Sequence Number (raw): 2423004287
    [Next Sequence Number: 602    (relative sequence number)]
    Acknowledgment Number: 141    (relative ack number)
    Acknowledgment number (raw): 2686489829
    0101 .... = Header Length: 20 bytes (5)
    Flags: 0x018 (PSH, ACK)
        000. .... .... = Reserved: Not set
        ...0 .... .... = Accurate ECN: Not set
        .... 0... .... = Congestion Window Reduced: Not set
        .... .0.. .... = ECN-Echo: Not set
        .... ..0. .... = Urgent: Not set
        .... ...1 .... = Acknowledgment: Set
        .... .... 1... = Push: Set
        .... .... .0.. = Reset: Not set
        .... .... ..0. = Syn: Not set
        .... .... ...0 = Fin: Not set
        [TCP Flags: ·······AP···]
    Window: 490
    [Calculated window size: 15680]
    [Window size scaling factor: 32]
    Checksum: 0x5e33 [unverified]
    [Checksum Status: Unverified]
    Urgent Pointer: 0
    [Timestamps]
        [Time since first frame in this TCP stream: 0.002211000 seconds]
        [Time since previous frame in this TCP stream: 0.000845000 seconds]
    [SEQ/ACK analysis]
        [iRTT: 0.000366000 seconds]
        [Bytes in flight: 601]
        [Bytes sent since last PSH flag: 601]
    TCP payload (601 bytes)
Hypertext Transfer Protocol
    HTTP/1.1 401 Unauthorized\r\n
        [Expert Info (Chat/Sequence): HTTP/1.1 401 Unauthorized\r\n]
        Response Version: HTTP/1.1
        Status Code: 401
        **[Status Code Description: Unauthorized]**
        Response Phrase: Unauthorized
    **WWW-Authenticate: Digest realm="blackMiner Configuration", nonce="5b92e921495ed2cb6bf5734303407f0f",** qop="auth"\r\n
    Content-Type: text/html\r\n
    Content-Length: 351\r\n
        [Content length: 351]
    Date: Wed, 13 Nov 2024 04:13:22 GMT\r\n
    Server: lighttpd/1.4.32\r\n
    \r\n
    [HTTP response 1/1]
    [Time since request: 0.001375000 seconds]
    [Request in frame: 1055]
    [Request URI: http://172.16.43.58/]
    File Data: 351 bytes
eXtensible Markup Language
    <?xml
    <!DOCTYPE html PUBLIC "-//W3C//DTD XHTML 1.0 Transitional//EN"\n         "http://www.w3.org/TR/xhtml1/DTD/xhtml1-transitional.dtd">
    <html

**Comment by b-rowan** [comment]
Looks like essentially a copy paste of the Antminer digest auth request, except for `blackMiner` instead of `antMiner`.  Default password is `root`/`root`?

Also pretty concerning that it has no 4028 API, that's a pain.

**Comment by Combinator78** [comment]
This is the response when scanning port 4028:

Frame 1148: 60 bytes on wire (480 bits), 60 bytes captured (480 bits) on interface \Device\NPF_{44671B79-9029-49A8-9492-11F546793270}, id 0
    Section number: 1
    Interface id: 0 (\Device\NPF_{44671B79-9029-49A8-9492-11F546793270})
        Interface name: \Device\NPF_{44671B79-9029-49A8-9492-11F546793270}
        Interface description: Ethernet
    Encapsulation type: Ethernet (1)
    Arrival Time: Nov 13, 2024 07:13:24.172266000 RTZ 2 (зима)
    [Time shift for this packet: 0.000000000 seconds]
    Epoch Time: 1731471204.172266000 seconds
    [Time delta from previous captured frame: 0.000428000 seconds]
    [Time delta from previous displayed frame: 0.499731000 seconds]
    [Time since reference or first frame: 5.208739000 seconds]
    Frame Number: 1148
    Frame Length: 60 bytes (480 bits)
    Capture Length: 60 bytes (480 bits)
    [Frame is marked: False]
    [Frame is ignored: False]
    [Protocols in frame: eth:ethertype:ip:tcp]
    [Coloring Rule Name: TCP RST]
    [Coloring Rule String: tcp.flags.reset eq 1]
Ethernet II, Src: Routerbo_e0:78:75 (64:d1:54:e0:78:75), Dst: Giga-Byt_bb:0a:b8 (18:c0:4d:bb:0a:b8)
    Destination: Giga-Byt_bb:0a:b8 (18:c0:4d:bb:0a:b8)
        Address: Giga-Byt_bb:0a:b8 (18:c0:4d:bb:0a:b8)
        .... ..0. .... .... .... .... = LG bit: Globally unique address (factory default)
        .... ...0 .... .... .... .... = IG bit: Individual address (unicast)
    Source: Routerbo_e0:78:75 (64:d1:54:e0:78:75)
        Address: Routerbo_e0:78:75 (64:d1:54:e0:78:75)
        .... ..0. .... .... .... .... = LG bit: Globally unique address (factory default)
        .... ...0 .... .... .... .... = IG bit: Individual address (unicast)
    Type: IPv4 (0x0800)
    Padding: 000000000000
Internet Protocol Version 4, Src: 172.16.43.58, Dst: 172.16.0.249
    0100 .... = Version: 4
    .... 0101 = Header Length: 20 bytes (5)
    Differentiated Services Field: 0x00 (DSCP: CS0, ECN: Not-ECT)
        0000 00.. = Differentiated Services Codepoint: Default (0)
        .... ..00 = Explicit Congestion Notification: Not ECN-Capable Transport (0)
    Total Length: 40
    Identification: 0x0000 (0)
    010. .... = Flags: 0x2, Don't fragment
        0... .... = Reserved bit: Not set
        .1.. .... = Don't fragment: Set
        ..0. .... = More fragments: Not set
    ...0 0000 0000 0000 = Fragment Offset: 0
    Time to Live: 63
    Protocol: TCP (6)
    Header Checksum: 0xb77c [validation disabled]
    [Header checksum status: Unverified]
    Source Address: 172.16.43.58
    Destination Address: 172.16.0.249
Transmission Control Protocol, Src Port: 4028, Dst Port: 26210, Seq: 1, Ack: 1, Len: 0
    Source Port: 4028
    Destination Port: 26210
    [Stream index: 51]
    [Conversation completeness: Incomplete (37)]
    [TCP Segment Len: 0]
    Sequence Number: 1    (relative sequence number)
    Sequence Number (raw): 0
    [Next Sequence Number: 1    (relative sequence number)]
    Acknowledgment Number: 1    (relative ack number)
    Acknowledgment number (raw): 4046392157
    0101 .... = Header Length: 20 bytes (5)
    Flags: 0x014 (RST, ACK)
        000. .... .... = Reserved: Not set
        ...0 .... .... = Accurate ECN: Not set
        .... 0... .... = Congestion Window Reduced: Not set
        .... .0.. .... = ECN-Echo: Not set
        .... ..0. .... = Urgent: Not set
        .... ...1 .... = Acknowledgment: Set
        .... .... 0... = Push: Not set
        .... .... .1.. = Reset: Set
            [Expert Info (Warning/Sequence): Connection reset (RST)]
        .... .... ..0. = Syn: Not set
        .... .... ...0 = Fin: Not set
        [TCP Flags: ·······A·R··]
    Window: 0
    [Calculated window size: 0]
    [Window size scaling factor: -1 (unknown)]
    Checksum: 0xb8d1 [unverified]
    [Checksum Status: Unverified]
    Urgent Pointer: 0
    [Timestamps]
        [Time since first frame in this TCP stream: 0.502431000 seconds]
        [Time since previous frame in this TCP stream: 0.000472000 seconds]
    [SEQ/ACK analysis]
        [This is an ACK to the segment in frame: 1145]
        [The RTT to ACK the segment was: 0.000472000 seconds]
        [iRTT: 0.000446000 seconds]

**Comment by b-rowan** [comment]
Ok, nothing on the RPC endpoints then.  Anything at `/cgi-bin/get_miner_status.cgi`?

**Comment by Combinator78** [comment]
http://172.16.43.58/cgi-bin/get_miner_status.cgi

{
"summary": {
"elapsed":"247622,MHS 5s=4869.1373,MHS av=4831.2598,Found Blocks=0,Getworks=16106,Accepted= 46.0000,Rejected= 46.0000,Hardware Errors=11693,Utility=8.43,Discarded=150682,Stale=0,Get Failures=0,Local Work=1840913,Remote Failures=0,Network Blocks=1720,Total MH=1196327970.7998,Work Utility=4360182.64,Difficulty Accepted=17971576832.00000000,Difficulty Rejected=23068672.00000000,Difficulty Stale=0.00000000,Best Share=163546,Device Hardware%=0.0001,Device Rejected%=0.1282,Pool Rejected%=0.1282,Pool Stale%=0.0000,Last getwork=1731551852|",
"ghs5s":"STATUS=S,When=1731551852,Code=11,Msg=Summary,Description=ccminer 2.3.3|SUMMARY,Elapsed=247622,MHS 5s=4869.1373,MHS av=4831.2598,Found Blocks=0,Getworks=16106,Accepted= 46.0000,Rejected= 46.0000,Hardware Errors=11693,Utility=8.43,Discarded=150682,Stale=0,Get Failures=0,Local Work=1840913,Remote Failures=0,Network Blocks=1720,Total MH=1196327970.7998,Work Utility=4360182.64,Difficulty Accepted=17971576832.00000000,Difficulty Rejected=23068672.00000000,Difficulty Stale=0.00000000,Best Share=163546,Device Hardware%=0.0001,Device Rejected%=0.1282,Pool Rejected%=0.1282,Pool Stale%=0.0000,Last getwork=1731551852|",
"ghsav":"STATUS=S,When=1731551852,Code=11,Msg=Summary,Description=ccminer 2.3.3|SUMMARY,Elapsed=247622,MHS 5s=4869.1373,MHS av=4831.2598",
"foundblocks":"0",
"getworks":"16106",
"accepted":" 46.0000",
"rejected":" 46.0000",
"hw":"11693",
"utility":"8.43",
"discarded":"150682",
"stale":"0",
"localwork":"1840913",
"wu":"4360182.64",
"diffa":"17971576832.00000000",
"diffr":"23068672.00000000",
"diffs":"0.00000000",
"bestshare":"163546"
},
"pools": [
{
"index":"0",
"url":"stratum+tcp://ltc.viabtc.io:3333",
"user":"Sipler1976.2A",
"status":"Alive",
"priority":"0",
"getworks":"16104",
"accepted":"34804",
"rejected":"46",
"discarded":"150682",
"stale":"0",
"diff":"524288.0000",
"diff1":"4456675",
"diffa":"17971576832.00000000",
"diffr":"23068672.00000000",
"diffs":"0.00000000",
"lsdiff":"524288.00000000",
"lstime":"0:00:02"
}
,
{
"index":"1",
"url":"stratum+tcp://ltc.viabtc.io:25",
"user":"Sipler1976.2A",
"status":"Alive",
"priority":"1",
"getworks":"1",
"accepted":"0",
"rejected":"0",
"discarded":"0",
"stale":"0",
"diff":"16384.0000",
"diff1":"0",
"diffa":"0.00000000",
"diffr":"0.00000000",
"diffs":"0.00000000",
"lsdiff":"0.00000000",
"lstime":"0"
}
,
{
"index":"2",
"url":"stratum+tcp://ltc.viabtc.io:443",
"user":"Sipler1976.2A",
"status":"Alive",
"priority":"2",
"getworks":"1",
"accepted":"0",
"rejected":"0",
"discarded":"0",
"stale":"0",
"diff":"16384.0000",
"diff1":"0",
"diffa":"0.00000000",
"diffr":"0.00000000",
"diffs":"0.00000000",
"lsdiff":"0.00000000",
"lstime":"0"
}
],
"devs": [
{
"index":"1",
"chain_acn":"108",
"freq":"800,fan_num=2,fan1=6030,fan2=6030,fan3=0,fan4=0,temp_num=12,temp1=49,temp1=68,temp1=48,temp1=69,temp2=47,temp2=70,temp2=51,temp2=72,temp3=46,temp3=70,temp3=48,temp3=67,temp4=0,temp4=0,temp4=0,temp4=0,temp_max=79,Device Hardware%=0.0000,no_matching_work=11694,chain_acn1=108,chain_acn2=108,chain_acn3=108,chain_acn4=0,chain_acs1= oooooooo oooooooo oooooooo oooooooo oooooooo oooooooo oooooooo oooooooo oooooooo oooooooo oooooooo oooooooo oooooooo oooo,chain_acs2= oooooooo oooooooo oooooooo oooooooo oooooooo oooooooo oooooooo oooooooo oooooooo oooooooo oooooooo oooooooo oooooooo oooo,chain_acs3= oooooooo oooooooo oooooooo oooooooo oooooooo oooooooo oooooooo oooooooo oooooooo oooooooo oooooooo oooooooo oooooooo oooo,chain_acs4=,chain_hw1=3587,chain_hw2=2150,chain_hw3=5957,chain_hw4=0,chain_rate1=1637.3616,chain_rate2=1696.4139,chain_rate3=1535.3618,chain_rate4=|",
"fan":"6030",
"temp":"49,temp1=68,temp1=48,temp1=69",
"chain_acs":" oooooooo oooooooo oooooooo oooooooo oooooooo oooooooo oooooooo oooooooo oooooooo oooooooo oooooooo oooooooo oooooooo oooo"
}
,
{
"index":"2",
"chain_acn":"108",
"freq":"800,fan_num=2,fan1=6030,fan2=6030,fan3=0,fan4=0,temp_num=12,temp1=49,temp1=68,temp1=48,temp1=69,temp2=47,temp2=70,temp2=51,temp2=72,temp3=46,temp3=70,temp3=48,temp3=67,temp4=0,temp4=0,temp4=0,temp4=0,temp_max=79,Device Hardware%=0.0000,no_matching_work=11694,chain_acn1=108,chain_acn2=108,chain_acn3=108,chain_acn4=0,chain_acs1= oooooooo oooooooo oooooooo oooooooo oooooooo oooooooo oooooooo oooooooo oooooooo oooooooo oooooooo oooooooo oooooooo oooo,chain_acs2= oooooooo oooooooo oooooooo oooooooo oooooooo oooooooo oooooooo oooooooo oooooooo oooooooo oooooooo oooooooo oooooooo oooo,chain_acs3= oooooooo oooooooo oooooooo oooooooo oooooooo oooooooo oooooooo oooooooo oooooooo oooooooo oooooooo oooooooo oooooooo oooo,chain_acs4=,chain_hw1=3587,chain_hw2=2150,chain_hw3=5957,chain_hw4=0,chain_rate1=1637.3616,chain_rate2=1696.4139,chain_rate3=1535.3618,chain_rate4=|",
"fan":"6030",
"temp":"47,temp2=70,temp2=51,temp2=72",
"chain_acs":" oooooooo oooooooo oooooooo oooooooo oooooooo oooooooo oooooooo oooooooo oooooooo oooooooo oooooooo oooooooo oooooooo oooo"
}
,
{
"index":"3",
"chain_acn":"108",
"freq":"800,fan_num=2,fan1=6030,fan2=6030,fan3=0,fan4=0,temp_num=12,temp1=49,temp1=68,temp1=48,temp1=69,temp2=47,temp2=70,temp2=51,temp2=72,temp3=46,temp3=70,temp3=48,temp3=67,temp4=0,temp4=0,temp4=0,temp4=0,temp_max=79,Device Hardware%=0.0000,no_matching_work=11694,chain_acn1=108,chain_acn2=108,chain_acn3=108,chain_acn4=0,chain_acs1= oooooooo oooooooo oooooooo oooooooo oooooooo oooooooo oooooooo oooooooo oooooooo oooooooo oooooooo oooooooo oooooooo oooo,chain_acs2= oooooooo oooooooo oooooooo oooooooo oooooooo oooooooo oooooooo oooooooo oooooooo oooooooo oooooooo oooooooo oooooooo oooo,chain_acs3= oooooooo oooooooo oooooooo oooooooo oooooooo oooooooo oooooooo oooooooo oooooooo oooooooo oooooooo oooooooo oooooooo oooo,chain_acs4=,chain_hw1=3587,chain_hw2=2150,chain_hw3=5957,chain_hw4=0,chain_rate1=1637.3616,chain_rate2=1696.4139,chain_rate3=1535.3618,chain_rate4=|",
"fan":"0",
"temp":"46,temp3=70,temp3=48,temp3=67",
"chain_acs":" oooooooo oooooooo oooooooo oooooooo oooooooo oooooooo oooooooo oooooooo oooooooo oooooooo oooooooo oooooooo oooooooo oooo"
}
]
}

**Comment by Combinator78** [comment]
after updating the firmware of the ASIC:
{
"summary": {
"elapsed":"92135",
"ghs5s":"5019.2598",
"ghsav":"4867.5902",
"foundblocks":"0",
"getworks":"6100",
"accepted":" 28.0000",
"rejected":" 28.0000",
"hw":"8496",
"utility":"8.45",
"discarded":"54553",
"stale":"0",
"localwork":"3180298",
"wu":"4425414.05",
"diffa":"6781140992.00000000",
"diffr":"14417920.00000000",
"diffs":"0.00000000",
"bestshare":"82854"
},
"pools": [
{
"index":"0",
"url":"stratum+tcp://ltc.viabtc.io:3333",
"user":"Sipler1976.4A",
"status":"Alive",
"priority":"0",
"getworks":"6100",
"accepted":"12979",
"rejected":"28",
"discarded":"54553",
"stale":"0",
"diff":"524288.0000",
"diff1":"1695627",
"diffa":"6781140992.00000000",
"diffr":"14417920.00000000",
"diffs":"0.00000000",
"lsdiff":"524288.00000000",
"lstime":"0:00:17"
}
,
{
"index":"1",
"url":"stratum+tcp://ltc.viabtc.io:25",
"user":"Sipler1976.4A",
"status":"Alive",
"priority":"1",
"getworks":"0",
"accepted":"0",
"rejected":"0",
"discarded":"0",
"stale":"0",
"diff":"16384.0000",
"diff1":"0",
"diffa":"0.00000000",
"diffr":"0.00000000",
"diffs":"0.00000000",
"lsdiff":"0.00000000",
"lstime":"0"
}
,
{
"index":"2",
"url":"stratum+tcp://ltc.viabtc.io:443",
"user":"Sipler1976.4A",
"status":"Alive",
"priority":"2",
"getworks":"0",
"accepted":"0",
"rejected":"0",
"discarded":"0",
"stale":"0",
"diff":"16384.0000",
"diff1":"0",
"diffa":"0.00000000",
"diffr":"0.00000000",
"diffs":"0.00000000",
"lsdiff":"0.00000000",
"lstime":"0"
}
],
"fan1":"5940",
"fan2":"5940",
"fan3":"0",
"fan4":"0",
"devs": [
{
"index":"1",
"chain_acn":"108",
"freq":"810",
"temp":[50, 72, 49, 70],
"chain_acs":" oooooooo oooooooo oooooooo oooooooo oooooooo oooooooo oooooooo oooooooo oooooooo oooooooo oooooooo oooooooo oooooooo oooo"
}
,
{
"index":"2",
"chain_acn":"108",
"freq":"810",
"temp":[52, 75, 53, 73],
"chain_acs":" oooooooo oooooooo oooooooo oooooooo oooooooo oooooooo oooooooo oooooooo oooooooo oooooooo oooooooo oooooooo oooooooo oooo"
}
,
{
"index":"3",
"chain_acn":"108",
"freq":"810",
"temp":[50, 75, 50, 71],
"chain_acs":" oooooooo oooooooo oooooooo oooooooo oooooooo oooooooo oooooooo oooooooo oooooooo oooooooo oooooooo oooooooo oooooooo oooo"
}
]
}

**Comment by smalldaemon** [comment]
You can also use port 8359

echo '{"command":"stats"}' | nc 8359

{"STATUS":[{"STATUS":"S","When":1730228015,"Code":22,"Msg":"CGMiner versions","Description":"ccminer 2.3.3"}],"VERSION":[{"CGMiner":"2.3.3","API":"3.1","Miner":"2.0.2.2","CompileTime":"2023-05-28 17-20-35 CST","Type":"Hammer D10"}],"id":1}

 {"command":"stats"}

{"STATUS":[{"STATUS":"S","When":1730228065,"Code":70,"Msg":"CGMiner stats","Description":"ccminer 2.3.3"}],"STATS":[{"CGMiner":"2.3.3","Miner":"2.0.2.2","CompileTime":"2023-05-28 17-20-35 CST","Type":"Hammer D10"}{"STATS":0,"ID":"A30","Elapsed":119161,"Calls":0,"Wait":0.000000,"Max":0.000000,"Min":99999999.000000,"MHS 5s":"4686.4886","MHS av":"4872.8713","miner_count":3,"frequency":"810","fan_num":4,"fan1":4650,"fan2":4500,"fan3":3870,"fan4":3930,"temp_num":12,"temp1":21,"temp1":42,"temp1":21,"temp1":45,"temp2":21,"temp2":40,"temp2":23,"temp2":42,"temp3":18,"temp3":39,"temp3":20,"temp3":40,"temp4":0,"temp4":0,"temp4":0,"temp4":0,"temp_max":52,"Device Hardware%":0.0000,"no_matching_work":7978,"chain_acn1":108,"chain_acn2":108,"chain_acn3":108,"chain_acn4":0,"chain_acs1":" oooooooo oooooooo oooooooo oooooooo oooooooo oooooooo oooooooo oooooooo oooooooo oooooooo oooooooo oooooooo oooooooo oooo","chain_acs2":" oooooooo oooooooo oooooooo oooooooo oooooooo oooooooo oooooooo oooooooo oooooooo oooooooo oooooooo oooooooo oooooooo oooo","chain_acs3":" oooooooo oooooooo oooooooo oooooooo oooooooo oooooooo oooooooo oooooooo oooooooo oooooooo oooooooo oooooooo oooooooo oooo","chain_acs4":"","chain_hw1":2133,"chain_hw2":2942,"chain_hw3":2903,"chain_hw4":0,"chain_rate1":"1578.2742","chain_rate2":"1594.3646","chain_rate3":"1513.8498","chain_rate4":""}],"id":1}

 {"command":"summary”}

{"STATUS":[{"STATUS":"S","When":1730228038,"Code":11,"Msg":"Summary","Description":"ccminer 2.3.3"}],"SUMMARY":[{"Elapsed":119134,"MHS 5s":"4885.0813","MHS av":"4872.9297","Found Blocks":0,"Getworks":8842,"Accepted":"156.0000","Rejected":"156.0000","Hardware Errors":7977,"Utility":6.71,"Discarded":76514,"Stale":0,"Get Failures":0,"Local Work":4123007,"Remote Failures":0,"Network Blocks":3323,"Total MH":580531131.4496,"Work Utility":4485762.79,"Difficulty Accepted":8804959701.00000000,"Difficulty Rejected":101813978.00000000,"Difficulty Stale":0.00000000,"Best Share":80831,"Device Hardware%":0.0001,"Device Rejected%":1.1431,"Pool Rejected%":1.1431,"Pool Stale%":0.0000,"Last getwork":1730228038}],"id":1}

**Comment by b-rowan** [comment]
Ok, give it a shot with the `hammer_support` branch, its basically a copy paste of antminer modern stuff, but I think most of it should work.

**Comment by Combinator78** [comment]
Sorry, I didn't quite understand what I needed to do.

**Comment by b-rowan** [comment]
> Sorry, I didn't quite understand what I needed to do.

Are you running from git? or pip?

**Comment by b-rowan** [comment]
Ah.  Ill release a version then.

**Comment by b-rowan** [comment]
Ok, try with 0.63.0

**Comment by Combinator78** [comment]
pyasic\miners\factory.py:867: UserWarning: Partially supported miner found: None, please open an issue with miner data and 
this model on GitHub (https://github.com/UpstreamData/pyasic/issues).
  warnings.warn(
MinerData(ip='172.16.26.13', datetime='2024-11-14T21:03:17.179209+03:00', timestamp=1731607397, device_info=DeviceInfo(make=<MinerMake.HAMMER: 'Hammer'>, model=None, firmware=<MinerFirmware.STOCK: 'Stock'>, algo=SHA256Algo), make='Hammer', model=None, firmware='Stock', algo='SHA256', mac='3C:A3:08:22:FC:61', api_ver='3.1', fw_ver='2023-05-05 15-02-12 CST', hostname='Hammer', hashrate=None, expected_hashrate=None, expected_hashboards=3, expected_chips=0, expected_fans=2, percent_expected_chips=None, percent_expected_hashrate=None, percent_expected_wattage=None, temperature_avg=None, env_temp=None, wattage=None, wattage_limit=None, voltage=None, fans=[Fan(speed=5910), Fan(speed=5850)], fan_psu=None, hashboards=[], total_chips=None, nominal=None, config=MinerConfig(pools=PoolConfig(groups=[PoolGroup(pools=[Pool(url='stratum+tcp://ltc.viabtc.io:3333', user='Sipler1976.4A', password='123'), Pool(url='stratum+tcp://ltc.viabtc.io:25', user='Sipler1976.4A', password='123'), Pool(url='stratum+tcp://ltc.viabtc.io:443', user='Sipler1976.4A', password='123')], quota=1, name='9NOH13')]), fan_mode=FanModeNormal(mode='normal', minimum_fans=1, minimum_speed=0), temperature=TemperatureConfig(target=None, hot=None, danger=None), mining_mode=MiningModeNormal(mode='normal')), fault_light=None, errors=[], is_mining=True, uptime=136571, efficiency=None, pools=[PoolMetrics(url=PoolUrl(scheme=<Scheme.STRATUM_V1: 'stratum+tcp'>, host='ltc.viabtc.io', port=3333, pubkey=None), accepted=19347, rejected=47, get_failures=0, remote_failures=0, active=True, alive=True, index=0, user='Sipler1976.4A', pool_rejected_percent=0.24234299267814788, pool_stale_percent=0.0), PoolMetrics(url=PoolUrl(scheme=<Scheme.STRATUM_V1: 'stratum+tcp'>, host='ltc.viabtc.io', port=25, pubkey=None), accepted=0, rejected=0, get_failures=0, remote_failures=0, active=False, alive=True, index=1, user='Sipler1976.4A', pool_rejected_percent=0, pool_stale_percent=0), PoolMetrics(url=PoolUrl(scheme=<Scheme.STRATUM_V1: 'stratum+tcp'>, host='ltc.viabtc.io', port=443, pubkey=None), accepted=0, rejected=0, get_failures=0, remote_failures=0, active=False, alive=True, index=2, user='Sipler1976.4A', pool_rejected_percent=0, pool_stale_percent=0)])

**Comment by Combinator78** [comment]
Now everything is great, thank you!

**Comment by Combinator78** [comment]
**Hummers are no longer detected**
Traceback (most recent call last):
  File "C:\vekus\test\test.py", line 17, in <module>
    asyncio.run(gather_miner_data())
  File "C:\Users\Vekus\AppData\Local\Programs\Python\Python311\Lib\asyncio\runners.py", line 190, in run
    return runner.run(main)
           ^^^^^^^^^^^^^^^^
  File "C:\Users\Vekus\AppData\Local\Programs\Python\Python311\Lib\asyncio\runners.py", line 118, in run
    return self._loop.run_until_complete(task)
           ^^^^^^^^^^^^^^^^^^^^^^^^^^^^^^^^^^^
  File "C:\Users\Vekus\AppData\Local\Programs\Python\Python311\Lib\asyncio\base_events.py", line 653, in run_until_complete
    return future.result()
           ^^^^^^^^^^^^^^^
  File "C:\vekus\test\test.py", line 10, in gather_miner_data
    miner = await get_miner("172.20.151.59")
            ^^^^^^^^^^^^^^^^^^^^^^^^^^^^^^^^
  File "C:\vekus\test\local_libs\pyasic\miners\factory.py", line 1361, in get_miner
    return await miner_factory.get_miner(ip)
           ^^^^^^^^^^^^^^^^^^^^^^^^^^^^^^^^^
  File "C:\vekus\test\local_libs\pyasic\miners\factory.py", line 708, in get_miner
    miner_type = await asyncio.wait_for(
                 ^^^^^^^^^^^^^^^^^^^^^^^
  File "C:\Users\Vekus\AppData\Local\Programs\Python\Python311\Lib\asyncio\tasks.py", line 479, in wait_for
    return fut.result()
           ^^^^^^^^^^^^
  File "C:\vekus\test\local_libs\pyasic\miners\factory.py", line 761, in _get_miner_type
    return await concurrent_get_first_result(tasks, lambda x: x is not None)
           ^^^^^^^^^^^^^^^^^^^^^^^^^^^^^^^^^^^^^^^^^^^^^^^^^^^^^^^^^^^^^^^^^
  File "C:\vekus\test\local_libs\pyasic\miners\factory.py", line 662, in concurrent_get_first_result
    res = await fut
          ^^^^^^^^^
  File "C:\Users\Vekus\AppData\Local\Programs\Python\Python311\Lib\asyncio\tasks.py", line 605, in _wait_for_one
    return f.result()  # May raise f.exception().
           ^^^^^^^^^^
  File "C:\vekus\test\local_libs\pyasic\miners\factory.py", line 785, in _get_miner_web
    if "HAMMER" in res.upper():
                   ^^^^^^^^^
AttributeError: 'NoneType' object has no attribute 'upper'

**Comment by b-rowan** [comment]
Try with 0.69.2, that part should be fixed at least.

**Comment by Combinator78** [comment]
Thank you! It works now

**Comment by Combinator78** [comment]
MAC address is no longer being determined

**Comment by b-rowan** [comment]
Something weird is going on with that miner, it's not returning a model in the get_system_info query (or at least not one that pyasic can find...)

**Comment by Combinator78** [comment]
But nothing changed in it, the firmware was not updated.

**Comment by smalldaemon** [comment]
Confirmed - same error. The miner has not been updated

**Comment by jpcomps** [comment]
if you are using the updated pyasic, the default password has been changed to ltc@dog, so if you changed it to root:

```
from pyasic import settings

settings.update("default_hammer_web_password", "root")
```

**Comment by b-rowan** [comment]
Good point.  Didn't realize this, but that makes a lot more sense sense.  Thanks!

**Comment by Combinator78** [comment]
Please correct the file pyasic/settings/__init__.py
"default_hammer_web_password": "ltc@dog" to
"default_hammer_web_password": "root"

**Comment by jpcomps** [comment]
Think its reasonable to change it back to root, just wanted to bring up the default password "should" or "is" ltc@dog on newer units, but its definitely possible that there are probably different variants of the FW that have it as root. 

Just a note in case this issue comes back. 

https://www.viperatech.com/wp-content/uploads/2022/11/D10-Operation-Manual-v2.pdf

Will put in a PR to change it back to root

**Comment by b-rowan** [comment]
> Will put in a PR to change it back to root

Merged.  Will release a version shortly.
